{
  "project_id": "PRJ-000000",
  "project_title": "Example Project",
  "project_type": "layered_nft_project",
  "collective_scope": "DAWC",
  "lead_member_id": "",
  "linked_assets": [],
  "linked_contracts": [],
  "drive_folder": "",
  "github_path": "examples/projects/PRJ-000000.json",
  "status": "draft",
  "notes": ""
}
